;0;1;2;3;4;5;6;7;8;9;10;11;12;13;14;15;16;17;18;19;20;21;22;23;24;25;26;27;28;29;30;31;32;33;34;35;36;37;38;39;40;41;42;43;44;45;46;47;48;49;50;51;52;53;54;55;56;57;58;59;60;61;62;63;64;65;66;67;68;69;70;71;72;73;74;75;76;77;78;79;80;81;82;83;84;85
0;MENGA0 X T0L1MA A0 V1V0 (C0M IM4GENS);Israel Vieira;Tom & Jerry in italiano | I momenti più divertenti di Jerry!  🐭 | WB Kids;WB Kids Italiano;Ed Sheeran, Martin Garrix, Kygo, Dua Lipa, Avicii, Robin Schulz, The Chainsmokers Style - Feeling Me;Haa Taa Deep;Churrasquinho do Menos é Mais - Melhor eu ir/Ligando os Fatos/Sonho de Amor/Deixa eu te querer;Grupo Menos é Mais;INCRÍVEIS PORTÕES E SALAS ESCONDIDAS QUE VOCÊ NÃO VIU ANTES;TechZone;Melhor filme de ação 2022 - filmes 2022 completos dublado 2022;Só Filmes;Scorpions, GNR, Bon Jovi, U2, Led Zeppelin, Aerosmith 📻Baladas de rock dos anos 70s 80s, 90s;Music In Paradise;Bolos fofíssimos DIY || Preparando bolos deliciosos inspirados em nossos personagens favoritos;Slime Sam Sapeca LIVE;;Avaliação NOVO HB20 2023 - Mudou pra melhor o Novo Hyundai Hb20 2023 mas e o farol de GOL?;Carro Chefe;SEM SPOILERS! Minha crítica de THOR AMOR E TROVÃO [opinião] // BORGOVERSO;Huuro;Você Consegue Escapar Desse Circulo?;Problems;"God of War Ragnarök - Trailer Cinematográfico: ""Pai e Filho""  | PS5, PS4";PlayStation Brasil;BOCA JUNIORS 5 X 6 CORINTHIANS - DISPUTA DE PÊNALTIS COMPLETA (OITAVAS LIBERTADORES 2022);ESPN Brasil;Se Você Souber a Curiosidade, o Vídeo Acaba...;Problems;Cabrini visita o Luva de Pedreiro e desvenda os segredos do fenômeno da internet;Domingo Espetacular;God of War Ragnarök - Collector's and Jötnar Editions Official Unboxing Video | PS5 & PS4 Games;PlayStation;MASTERCHEF BRASIL (05/07/2022) | PARTE 3 | EP 08 | TEMP 09;MasterChef Brasil;MASTERCHEF BRASIL (05/07/2022) | PARTE 2 | EP 08 | TEMP 09;MasterChef Brasil;AGORA TEMOS MINÉRIOS INFINITOS DENTRO DE 1 BLOCO NO MINECRAFT - StoneBlock Ep.2;IRMANDADE;EMOCIONANTE!! OLHA como o Craque Neto reagiu a Boca Juniors (5)0x0(6) Corinthians pela Libertadores;Rádio Craque Neto;Ini Pendapat Keterlaluan | KH. Bahauddin Nursalim;Kado Kehidupan;FL4M3NG0 X T0L1M4 40 V1V0;TrixSports;"O maior erro do whatsapp foi lançar as ""reações""";T3ddy;MIX SERTANEJO UNIVERSITÁRIO - Henrique  Juliano, Maiara e Maraísa, Gusttavo Lima,Zé Neto e Cristiano;Canal Sertanejo;Em destaque;Descubra os seus novos criadores favoritos;Eles são os loucos por música, gurus linguísticos e matemáticos que a internet ama. Conheça os Criadores em Destaque, do YouTube.;SAIBA MAIS;Pica Pau em Português | Ganhe um Prêmio | Desenhos Animados | WildBrain em Português;WildBrain em Português;Manú Paiva - Alívio | Cover (Jessé Aguiar);Manú Paiva;MASTERCHEF BRASIL (05/07/2022) | PARTE 1 | EP 08 | TEMP 09;MasterChef Brasil;Provando Guloseimas do Brasil Pela Primeira Vez ft. Baptista Miranda;Hora Épica;Best of Mercuri 88 TikTok Compilation | Funny Manuel Mercuri Tik Toks 2021;TikHQ;M33,,G00 - ʟɪʙ3ʀᴛ4ᴅ0ʀ3s 2022;ボ;ASSISTI THOR: AMOR E TROVÃO - REVIEW COMPLETO [Sem Spoilers];Ei Nerd;Acoustic 2022 / The Best Acoustic Covers of Popular Songs 2022 - English Love Songs Cover ♥;Acoustic Greatest Hits.;;;;;;;;;;;;;;;;;
1;Os Simpsons - Circo de Lembranças de Monty Burns - Dublado Português;Maciel Ícaro S. Costa;Scorpions, GNR, Bon Jovi, U2, Led Zeppelin, Aerosmith 📻Baladas de rock dos anos 70s 80s, 90s;Music In Paradise;100 Processos de Produção Incríveis que Você Nunca Viu Antes;Infinito;crianças RICAS e MIMADAS do Tik Tok;T3ddy;Boyce Avenue Greatest Hits Full Album 2021 |  Best Songs Of Boyce Avenue 2021 |  Acoustic songs 2021;Acoustic Songs Collection;Churrasquinho do Menos é Mais - Melhor eu ir/Ligando os Fatos/Sonho de Amor/Deixa eu te querer;Grupo Menos é Mais;COMO ROBINHO ACABOU COM SUA CARREIRA DE FORMA TRISTE! Ele perdeu tudo;SobreNovas;Pegadinhas ineditas 2022 do toninho tornado Ep.1  João kléber 🤣;CAUANZ;;Avaliação NOVO HB20 2023 - Mudou pra melhor o Novo Hyundai Hb20 2023 mas e o farol de GOL?;Carro Chefe;Cabrini visita o Luva de Pedreiro e desvenda os segredos do fenômeno da internet;Domingo Espetacular;SEM SPOILERS! Minha crítica de THOR AMOR E TROVÃO [opinião] // BORGOVERSO;Huuro;God of War Ragnarök - Collector's and Jötnar Editions Official Unboxing Video | PS5 & PS4 Games;PlayStation;BOCA JUNIORS 5 X 6 CORINTHIANS - DISPUTA DE PÊNALTIS COMPLETA (OITAVAS LIBERTADORES 2022);ESPN Brasil;"God of War Ragnarök - Trailer Cinematográfico: ""Pai e Filho""  | PS5, PS4";PlayStation Brasil;AGORA TEMOS MINÉRIOS INFINITOS DENTRO DE 1 BLOCO NO MINECRAFT - StoneBlock Ep.2;IRMANDADE;Dona Ruth recebe Murilo Huff  (Receita Moqueca de Peixe);Dona Ruth;CLASSIFICAÇÃO HISTÓRICA NUM DOS MAIORES JOGOS DO TIMÃO QUE JÁ VI. CÁSSIO E GIL DECISIVO. VP MONSTRO;Chico Garcia;MASTERCHEF BRASIL (05/07/2022) | PARTE 2 | EP 08 | TEMP 09;MasterChef Brasil;League of Legends: Wild Rift | Prévia da Atualização 3.3;WildRiftBR;Boca Juniors 0 (5) x (6) 0 Corinthians - TODOS OS PÊNALTIS E MELHORES MOMENTOS;SBT Sports;Feliz aniversário | Rimas infantis e canções infantis | Banana Cartoon - After School Club - Kids;Banana Cartoon - After School Club - Kids Cartoons;Pica Pau em Português | Ganhe um Prêmio | Desenhos Animados | WildBrain em Português;WildBrain em Português;Queen - I want to break free (subtitulado al español);arthur hersan;UM SONHO QUE CUSTOU R$5,2 MILHÕES EM MULTA…;Diggo;Sertanejo 2022 Atualizado Abril 2022 | Sertanejo Mais Tocadas 2022 -  2022 - 4;JB MUSIC;Ed Sheeran, Martin Garrix, Kygo, Dua Lipa, Avicii, Robin Schulz, The Chainsmokers Style - Feeling Me;Haa Taa Deep;ASSISTI THOR: AMOR E TROVÃO - REVIEW COMPLETO [Sem Spoilers];Ei Nerd;Bolos fofíssimos DIY || Preparando bolos deliciosos inspirados em nossos personagens favoritos;Slime Sam Sapeca LIVE;Os Vídeos Mais HILÁRIOS e ENGRAÇADO do OLI NATO (@oli_natu) - TENTE NÂO RIR 😂;TikTok Premium;Manú Paiva - Alívio | Cover (Jessé Aguiar);Manú Paiva;Melhor filme de ação 2022 - filmes 2022 completos dublado 2022;Só Filmes;Se Eu Tomar Dano, Fica Mais Realista!;Geleia;;;;;;;;;;;;;;;;;;;;;
2;❤️❤️❤️❤️❤️ .....FL4M3NG0 X T0L1M4 A0 V1V0 C0M IM4G3NS ......  🖤 🖤 🖤 🖤;ʙᴜsᴢᴀᴏ ʟɪɴᴋs;CASIMIRO REAGE: COMIDA JAPONESA! UM LÁMEN BEM JOGADO PEGA VOCÊS? | Cortes do Casimito;Cortes do Casimito [OFICIAL];Ed Sheeran, Martin Garrix, Kygo, Dua Lipa, Avicii, Robin Schulz, The Chainsmokers Style - Feeling Me;Haa Taa Deep;Auron reacciona a XpressTV 20 Cosas Raras que puedes comprar en Internet;Reacciones del calvo;FL4M3NG0 X T0L1M4 40 V1V0;TrixSports;Máquinas Soviéticas Malucas Que Você Não Vai Acreditar Que Existem;Fala Sério;MIX SERTANEJO UNIVERSITÁRIO - Henrique  Juliano, Maiara e Maraísa, Gusttavo Lima,Zé Neto e Cristiano;Canal Sertanejo;REAGINDO O ZANELLA COM OUTRA!;Eu você e nós;버디 8개 필드맞나? 후반전 가즈아~~ 구니CC 형님들 죄송합니다 ㅋㅋ 논두렁 부사골 골프TV;논두렁 부사골 골프TV[김성필];Henrique e Juliano 2022 - As Mais Tocadas do Henrique e Juliano 2022 - Top Sertanejo 2022;Mix Sertanejo;Pica-Pau em Português | Insignificante | Desenhos Antigos de Pica-Pau | Desenhos Animado | WildBrain;WildBrain em Português;Acoustic 2022 / The Best Acoustic Covers of Popular Songs 2022 - English Love Songs Cover ♥;Acoustic Greatest Hits.;;Avaliação NOVO HB20 2023 - Mudou pra melhor o Novo Hyundai Hb20 2023 mas e o farol de GOL?;Carro Chefe;BOCA JUNIORS 5 X 6 CORINTHIANS - DISPUTA DE PÊNALTIS COMPLETA (OITAVAS LIBERTADORES 2022);ESPN Brasil;God of War Ragnarök - Collector's and Jötnar Editions Official Unboxing Video | PS5 & PS4 Games;PlayStation;SEM SPOILERS! Minha crítica de THOR AMOR E TROVÃO [opinião] // BORGOVERSO;Huuro;CLASSIFICAÇÃO HISTÓRICA NUM DOS MAIORES JOGOS DO TIMÃO QUE JÁ VI. CÁSSIO E GIL DECISIVO. VP MONSTRO;Chico Garcia;League of Legends: Wild Rift | Prévia da Atualização 3.3;WildRiftBR;SAIU! DATA DE LANÇAMENTO E NOVO TRAILER DE GOD OF WAR RAGNAROK!;Sidão do Game;aespa 에스파 'Girls' MV Teaser;SMTOWN;"God of War Ragnarök - Trailer Cinematográfico: ""Pai e Filho""  | PS5, PS4";PlayStation Brasil;BRUNO GAGLIASSO - QUEM PODE, POD #01;GIOH;MASTERCHEF BRASIL (05/07/2022) | PARTE 2 | EP 08 | TEMP 09;MasterChef Brasil;Dona Ruth recebe Murilo Huff  (Receita Moqueca de Peixe);Dona Ruth;Música calmante para os nervos 🐬 música curativa para o coração e vasos sanguíneos, relaxamentoalma;Soothing Your Soul;Saúde emocional - Cultive esses 7 hábitos  |  Psiquiatra Fernando Fernandes;Psiquiatra Fernando Fernandes;lofi hip hop radio - beats to sleep/chill to;Lofi Girl;"NBA ""1 In A Trillion"" MOMENTS";KingSwish;realmente delicioso! Frango de mercado tradicional coreano mais famoso da Coréia Top6 /comida de rua;하이푸디 HiFoodie;Melhor filme de ação 2022 - filmes 2022 completos dublado 2022;Só Filmes;Giant Rubber Band Ball Drop from 165m Dam! World’s Highest Bounce?;How Ridiculous;Pela Manhã (Clipe Oficial) - Alessandro Vilas Boas | Som do Reino;Som do Reino;;;;;;;;;;;;;;;;;;;;;
3;FL4M3NG0 X T0L1M4 40 V1V0;TrixSports;Boyce Avenue Greatest Hits Full Album 2020 - Best Songs Of Boyce Avenue 2020 - Acoustic songs 2020;Music Top 1;TENTE NÃO RIR! OS MELHORES TIKTOK COMÉDIA DE LKZINHU!;Canal Risadinha;Manú Paiva - Alívio | Cover (Jessé Aguiar);Manú Paiva;Ed Sheeran, Martin Garrix, Kygo, Dua Lipa, Avicii, Robin Schulz, The Chainsmokers Style - Feeling Me;Haa Taa Deep;Tive que provar todos os chicletes só pra ver qual é o melhor;T3ddy;❤️❤️❤️❤️❤️ .....FL4M3NG0 X T0L1M4 A0 V1V0 C0M IM4G3NS ......  🖤 🖤 🖤 🖤;ʙᴜsᴢᴀᴏ ʟɪɴᴋs;Churrasquinho do Menos é Mais - Melhor eu ir/Ligando os Fatos/Sonho de Amor/Deixa eu te querer;Grupo Menos é Mais;Em destaque;Descubra os seus novos criadores favoritos;Eles são os loucos por música, gurus linguísticos e matemáticos que a internet ama. Conheça os Criadores em Destaque, do YouTube.;SAIBA MAIS;Trend do TikTok  #shorts;euVicky;MIX SERTANEJO UNIVERSITÁRIO - Henrique  Juliano, Maiara e Maraísa, Gusttavo Lima,Zé Neto e Cristiano;Canal Sertanejo;Eu, a Patroa e as Crianças | 2ª Temporada Completa (Dublado HD);VITOR KEVIN;Scorpions, GNR, Bon Jovi, U2, Led Zeppelin, Aerosmith 📻Baladas de rock dos anos 70s 80s, 90s;Music In Paradise;;Avaliação NOVO HB20 2023 - Mudou pra melhor o Novo Hyundai Hb20 2023 mas e o farol de GOL?;Carro Chefe;SEM SPOILERS! Minha crítica de THOR AMOR E TROVÃO [opinião] // BORGOVERSO;Huuro;"God of War Ragnarök - Trailer Cinematográfico: ""Pai e Filho""  | PS5, PS4";PlayStation Brasil;CLASSIFICAÇÃO HISTÓRICA NUM DOS MAIORES JOGOS DO TIMÃO QUE JÁ VI. CÁSSIO E GIL DECISIVO. VP MONSTRO;Chico Garcia;God of War Ragnarök - Collector's and Jötnar Editions Official Unboxing Video | PS5 & PS4 Games;PlayStation;BOCA JUNIORS 5 X 6 CORINTHIANS - DISPUTA DE PÊNALTIS COMPLETA (OITAVAS LIBERTADORES 2022);ESPN Brasil;MASTERCHEF BRASIL (05/07/2022) | PARTE 2 | EP 08 | TEMP 09;MasterChef Brasil;AGORA TEMOS MINÉRIOS INFINITOS DENTRO DE 1 BLOCO NO MINECRAFT - StoneBlock Ep.2;IRMANDADE;League of Legends: Wild Rift | Prévia da Atualização 3.3;WildRiftBR;aespa 에스파 'Girls' MV Teaser;SMTOWN;MASTERCHEF BRASIL (05/07/2022) | PARTE 3 | EP 08 | TEMP 09;MasterChef Brasil;XODÓ (Visualizer) - Juliette;Juliette;Pica-Pau em Português | Insignificante | Desenhos Antigos de Pica-Pau | Desenhos Animado | WildBrain;WildBrain em Português;Testei Seeds Incríveis Que Você Nunca Viu!;Redzinbr;Relaxing Whiskey Blues Music | Best Of Slow Blues /Rock Ballads | Fantastic Electric Guitar Blues;JAZZ & BLUES;ESSE OPALA FOI PROIBIDO DE CORRER NA ARRANCADA!!;Curva 1;Whindersson Nunes  ESCOLA DE RICO E DE POBRE animação;Animalex;Uma playlist para melhorar o seu dia;Lyrics de Músicas;Cartola - Preciso Me Encontrar (Áudio Oficial);Cartola Oficial;Melhor filme de ação 2022 - filmes 2022 completos dublado 2022;Só Filmes;;;;;;;;;;;;;;;;;
4;❤️❤️❤️❤️❤️ .....FL4M3NG0 X T0L1M4 A0 V1V0 C0M IM4G3NS ......  🖤 🖤 🖤 🖤;ʙᴜsᴢᴀᴏ ʟɪɴᴋs;Henrique e Juliano Cd Completo 2022 - As Mais Tocadas do Henrique e Juliano 2022 -Top Sertanejo 2022;Mix Sertanejo;Ed Sheeran, Martin Garrix, Kygo, Dua Lipa, Avicii, Robin Schulz, The Chainsmokers Style - Feeling Me;Haa Taa Deep;Pica Pau em Português | Ganhe um Prêmio | Desenhos Animados | WildBrain em Português;WildBrain em Português;FL4M3NG0 X T0L1M4 40 V1V0;TrixSports;Churrasquinho do Menos é Mais - Melhor eu ir/Ligando os Fatos/Sonho de Amor/Deixa eu te querer;Grupo Menos é Mais;Scorpions, GNR, Bon Jovi, U2, Led Zeppelin, Aerosmith 📻Baladas de rock dos anos 70s 80s, 90s;Music In Paradise;Uma playlist para melhorar o seu dia;Lyrics de Músicas;Em destaque;Descubra os seus novos criadores favoritos;Eles são os loucos por música, gurus linguísticos e matemáticos que a internet ama. Conheça os Criadores em Destaque, do YouTube.;SAIBA MAIS;Trend do TikTok  #shorts;euVicky;Testei Seeds Incríveis Que Você Nunca Viu!;Redzinbr;Eu a Patroa e as Crianças | 5ª Temporada Completa (Dublado HD);VITOR KEVIN;Boyce Avenue Greatest Hits Full Album 2021 |  Best Songs Of Boyce Avenue 2021 |  Acoustic songs 2021;Acoustic Songs Collection;;Avaliação NOVO HB20 2023 - Mudou pra melhor o Novo Hyundai Hb20 2023 mas e o farol de GOL?;Carro Chefe;SEM SPOILERS! Minha crítica de THOR AMOR E TROVÃO [opinião] // BORGOVERSO;Huuro;"God of War Ragnarök - Trailer Cinematográfico: ""Pai e Filho""  | PS5, PS4";PlayStation Brasil;CLASSIFICAÇÃO HISTÓRICA NUM DOS MAIORES JOGOS DO TIMÃO QUE JÁ VI. CÁSSIO E GIL DECISIVO. VP MONSTRO;Chico Garcia;God of War Ragnarök - Collector's and Jötnar Editions Official Unboxing Video | PS5 & PS4 Games;PlayStation;BOCA JUNIORS 5 X 6 CORINTHIANS - DISPUTA DE PÊNALTIS COMPLETA (OITAVAS LIBERTADORES 2022);ESPN Brasil;MASTERCHEF BRASIL (05/07/2022) | PARTE 2 | EP 08 | TEMP 09;MasterChef Brasil;League of Legends: Wild Rift | Prévia da Atualização 3.3;WildRiftBR;AGORA TEMOS MINÉRIOS INFINITOS DENTRO DE 1 BLOCO NO MINECRAFT - StoneBlock Ep.2;IRMANDADE;XODÓ (Visualizer) - Juliette;Juliette;MASTERCHEF BRASIL (05/07/2022) | PARTE 3 | EP 08 | TEMP 09;MasterChef Brasil;aespa 에스파 'Girls' MV Teaser;SMTOWN;Manú Paiva - Alívio | Cover (Jessé Aguiar);Manú Paiva;MASTERCHEF BRASIL (05/07/2022) | PARTE 1 | EP 08 | TEMP 09;MasterChef Brasil;Padre Pio e Lutero;Padre Paulo Ricardo;ASSISTI THOR: AMOR E TROVÃO - REVIEW COMPLETO [Sem Spoilers];Ei Nerd;MIX SERTANEJO UNIVERSITÁRIO - Henrique  Juliano, Maiara e Maraísa, Gusttavo Lima,Zé Neto e Cristiano;Canal Sertanejo;MÃE BOA vs MÁ - Fui Adotada Por Uma Mãe Rica - Minha Família Maluca, por Desafio Aceito;Desafio Aceito;O Siri Cascudo | Bob Esponja em Português;Bob Esponja em Português;Relaxing Whiskey Blues Music | Best Of Slow Blues /Rock Ballads | Fantastic Electric Guitar Blues;JAZZ & BLUES;;;;;;;;;;;;;;;;;
5;FL4M3NG0 X T0L1M4 40 V1V0;TrixSports;Kate Bush - Running up that Hill [Legendado/Tradução];Bichos & Traduções;Eu a Patroa e as Crianças | 5ª Temporada Completa (Dublado HD);VITOR KEVIN;UM SONHO QUE CUSTOU R$5,2 MILHÕES EM MULTA…;Diggo;Máquinas Soviéticas Malucas Que Você Não Vai Acreditar Que Existem;Fala Sério;Shakira, Rauw Alejandro - Te Felicito (Letra) Te felicito qué bien actúas;Odilon Huamani;Pica-Pau em Português | Insignificante | Desenhos Antigos de Pica-Pau | Desenhos Animado | WildBrain;WildBrain em Português;Policial de folga atira em assaltantes;Band Jornalismo;;BOCA JUNIORS 5 X 6 CORINTHIANS - DISPUTA DE PÊNALTIS COMPLETA (OITAVAS LIBERTADORES 2022);ESPN Brasil;Cabrini visita o Luva de Pedreiro e desvenda os segredos do fenômeno da internet;Domingo Espetacular;Avaliação NOVO HB20 2023 - Mudou pra melhor o Novo Hyundai Hb20 2023 mas e o farol de GOL?;Carro Chefe;"God of War Ragnarök - Trailer Cinematográfico: ""Pai e Filho""  | PS5, PS4";PlayStation Brasil;Boca Juniors 0 (5) x (6) 0 Corinthians - TODOS OS PÊNALTIS E MELHORES MOMENTOS;SBT Sports;MASTERCHEF BRASIL (05/07/2022) | PARTE 3 | EP 08 | TEMP 09;MasterChef Brasil;HULK 'EXORCIZA' FANTASMA, ATLÉTICO-MG BATE O EMELEC E AVANÇA ÀS QUARTAS DE FINAL NA LIBERTADORES;ESPN Brasil;MASTERCHEF BRASIL (05/07/2022) | PARTE 2 | EP 08 | TEMP 09;MasterChef Brasil;SEM SPOILERS! Minha crítica de THOR AMOR E TROVÃO [opinião] // BORGOVERSO;Huuro;God of War Ragnarök - Collector's and Jötnar Editions Official Unboxing Video | PS5 & PS4 Games;PlayStation;Hyundai Novo HB20;Hyundai Motor Brasil;INTERNACIONAL 4 x 1  COLO COLO | MELHORES MOMENTOS | CONMEBOL SUDAMERICANA 2022;CONMEBOL Sudamericana;Ini Pendapat Keterlaluan | KH. Bahauddin Nursalim;Kado Kehidupan;Ed Sheeran, Martin Garrix, Avicii, Kygo, Dua Lipa, The Chainsmokers Style - Feeling Me;Deep Mood.;Manú Paiva - Alívio | Cover (Jessé Aguiar);Manú Paiva;Jorge e M.a.t.e.u.s CD COMPLETO SO AS MELHORES | TOP MÚSICAS SERTANEJO MELHORES 2021;MIX SERTANEJO;Em destaque;Descubra os seus novos criadores favoritos;Eles são os loucos por música, gurus linguísticos e matemáticos que a internet ama. Conheça os Criadores em Destaque, do YouTube.;SAIBA MAIS;Deliciosa comida tradicional do mercado - TOP 3 Frango, tteokbokki, hotteok / comida de rua coreana;찐푸드 JJin Food;ASSISTI THOR: AMOR E TROVÃO - REVIEW COMPLETO [Sem Spoilers];Ei Nerd;Restauração de arma SUPER-RARA A WARRIOR Air Pistol .177;Awesome Restorations;AVATAR 2 - New Trailer, Movies 2022 / 4K Ultra HD;A piece of film;Queen - Bohemian Rhapsody (Live Aid 1985);Live Aid;o jão é uma maquina de mentir e esse video é a prova;Podpah Fora de Contexto;Palmeiras 5 x 0 Cerro Porteño | Melhores Momentos Completo 2022;Futbola;WORLD´S LARGEST RC AIRWOLF BLACK BELL-222 ELECTRIC SCALE 1:3.5 MODEL HELICOPTER FLIGHT DEMONSTRATION;RC MEDIA WORLD;;;;;;;;;;;;;;;;;
6;FL4M3NG0 X T0L1M4 40 V1V0;TrixSports;Scorpions, GNR, Bon Jovi, U2, Led Zeppelin, Aerosmith 📻Baladas de rock dos anos 70s 80s, 90s;Music In Paradise;Pica Pau em Português | Ganhe um Prêmio | Desenhos Animados | WildBrain em Português;WildBrain em Português;Jorge e M.a.t.e.u.s CD COMPLETO SO AS MELHORES | TOP MÚSICAS SERTANEJO MELHORES 2021;MIX SERTANEJO;Ed Sheeran, Martin Garrix, Kygo, Dua Lipa, Avicii, Robin Schulz, The Chainsmokers Style - Feeling Me;Haa Taa Deep;Policial de folga atira em assaltantes;Band Jornalismo;Churrasquinho do Menos é Mais - Melhor eu ir/Ligando os Fatos/Sonho de Amor/Deixa eu te querer;Grupo Menos é Mais;Deliciosa comida tradicional do mercado - TOP 3 Frango, tteokbokki, hotteok / comida de rua coreana;찐푸드 JJin Food;;BRUNO GAGLIASSO - QUEM PODE, POD #01;GIOH;"God of War Ragnarök - Trailer Cinematográfico: ""Pai e Filho""  | PS5, PS4";PlayStation Brasil;Avaliação NOVO HB20 2023 - Mudou pra melhor o Novo Hyundai Hb20 2023 mas e o farol de GOL?;Carro Chefe;Boca Juniors 0 (5) x (6) 0 Corinthians - TODOS OS PÊNALTIS E MELHORES MOMENTOS;SBT Sports;SAIU! DATA DE LANÇAMENTO E NOVO TRAILER DE GOD OF WAR RAGNAROK!;Sidão do Game;SEM SPOILERS! Minha crítica de THOR AMOR E TROVÃO [opinião] // BORGOVERSO;Huuro;God of War Ragnarök - Collector's and Jötnar Editions Official Unboxing Video | PS5 & PS4 Games;PlayStation;HULK 'EXORCIZA' FANTASMA, ATLÉTICO-MG BATE O EMELEC E AVANÇA ÀS QUARTAS DE FINAL NA LIBERTADORES;ESPN Brasil;Cabrini visita o Luva de Pedreiro e desvenda os segredos do fenômeno da internet;Domingo Espetacular;BOCA JUNIORS 5 X 6 CORINTHIANS - DISPUTA DE PÊNALTIS COMPLETA (OITAVAS LIBERTADORES 2022);ESPN Brasil;MASTERCHEF BRASIL (05/07/2022) | PARTE 2 | EP 08 | TEMP 09;MasterChef Brasil;AGORA TEMOS MINÉRIOS INFINITOS DENTRO DE 1 BLOCO NO MINECRAFT - StoneBlock Ep.2;IRMANDADE;버디 8개 필드맞나? 후반전 가즈아~~ 구니CC 형님들 죄송합니다 ㅋㅋ 논두렁 부사골 골프TV;논두렁 부사골 골프TV[김성필];Os Vídeos Mais HILÁRIOS e ENGRAÇADO do OLI NATO (@oli_natu) - TENTE NÂO RIR 😂 PARTE 2;TikTok Premium;Acoustic 2022 / The Best Acoustic Covers of Popular Songs 2022 - English Love Songs Cover ♥;Acoustic Greatest Hits.;Bolos fofíssimos DIY || Preparando bolos deliciosos inspirados em nossos personagens favoritos;Slime Sam Sapeca LIVE;Em destaque;Descubra os seus novos criadores favoritos;Eles são os loucos por música, gurus linguísticos e matemáticos que a internet ama. Conheça os Criadores em Destaque, do YouTube.;SAIBA MAIS;SET Tatuapé Conceito 2 - Ryan SP, Kako, Joãozinho VT, Marks, GP e MC Erik (GR6 Explode) DJ Boy e GM;GR6 EXPLODE;❤️❤️❤️❤️❤️ .....FL4M3NG0 X T0L1M4 A0 V1V0 C0M IM4G3NS ......  🖤 🖤 🖤 🖤;ʙᴜsᴢᴀᴏ ʟɪɴᴋs;Maratona em Casa com a Turma #FicaemCasa 🏠 | Turma da Mônica;Turma da Mônica;Máquinas Soviéticas Malucas Que Você Não Vai Acreditar Que Existem;Fala Sério;Louvores de Adoração 2022 - Top 70 Músicas Gospel Mais Tocadas 2022 - Hinos Evangélicos 2022 #30;MG - Músicas Gospel ♪;UM SONHO QUE CUSTOU R$5,2 MILHÕES EM MULTA…;Diggo;Música calmante para os nervos 🌿 música curativa para o coração e vasos sanguíneos, relaxamento;Love YourSelf;MPB AS MELHORES PRO CAFE DA MANHA, SKANK, NANDO REIS, KIDABELHA, THIAGO IORC;88 Bier;;;;;;;;;;;;;;;;;
7;8 Minutos Para Rir Com Igor Guimaraes;Stand Up Brasil;Ed Sheeran, Martin Garrix, Kygo, Dua Lipa, Avicii, Robin Schulz, The Chainsmokers Style - Feeling Me;Haa Taa Deep;Você Consegue Descobrir a ilusão?;Problems;Manú Paiva - Alívio | Cover (Jessé Aguiar);Manú Paiva;Boyce Avenue Greatest Hits Full Album 2021 |  Best Songs Of Boyce Avenue 2021 |  Acoustic songs 2021;Acoustic Songs Collection;Whindersson Nunes_ EU ME ESTRESSO FÁCIL (animação);Animalex;Churrasquinho do Menos é Mais - Melhor eu ir/Ligando os Fatos/Sonho de Amor/Deixa eu te querer;Grupo Menos é Mais;BUSQUEI BOCA DE 09 NA ESCOLA DE R8 ‹ JonVlogs ›;Jon Vlogs;;Avaliação NOVO HB20 2023 - Mudou pra melhor o Novo Hyundai Hb20 2023 mas e o farol de GOL?;Carro Chefe;SEM SPOILERS! Minha crítica de THOR AMOR E TROVÃO [opinião] // BORGOVERSO;Huuro;"God of War Ragnarök - Trailer Cinematográfico: ""Pai e Filho""  | PS5, PS4";PlayStation Brasil;Você Consegue Escapar Desse Circulo?;Problems;God of War Ragnarök - Collector's and Jötnar Editions Official Unboxing Video | PS5 & PS4 Games;PlayStation;CLASSIFICAÇÃO HISTÓRICA NUM DOS MAIORES JOGOS DO TIMÃO QUE JÁ VI. CÁSSIO E GIL DECISIVO. VP MONSTRO;Chico Garcia;BEBÊ da JANELA nos ATACOU no Minecraft!;TazerCraft;MASTERCHEF BRASIL (05/07/2022) | PARTE 2 | EP 08 | TEMP 09;MasterChef Brasil;BOCA JUNIORS 5 X 6 CORINTHIANS - DISPUTA DE PÊNALTIS COMPLETA (OITAVAS LIBERTADORES 2022);ESPN Brasil;MASTERCHEF BRASIL (05/07/2022) | PARTE 3 | EP 08 | TEMP 09;MasterChef Brasil;League of Legends: Wild Rift | Prévia da Atualização 3.3;WildRiftBR;AGORA TEMOS MINÉRIOS INFINITOS DENTRO DE 1 BLOCO NO MINECRAFT - StoneBlock Ep.2;IRMANDADE;Trend do TikTok  #shorts;euVicky;Pica Pau em Português | Ganhe um Prêmio | Desenhos Animados | WildBrain em Português;WildBrain em Português;MIX SERTANEJO UNIVERSITÁRIO - Henrique  Juliano, Maiara e Maraísa, Gusttavo Lima,Zé Neto e Cristiano;Canal Sertanejo;COLEÇÂO DE AVENTURAS de Slime Sam Sapeca;SLIME SAM SAPECA;Em destaque;Descubra os seus novos criadores favoritos;Eles são os loucos por música, gurus linguísticos e matemáticos que a internet ama. Conheça os Criadores em Destaque, do YouTube.;SAIBA MAIS;Scorpions, GNR, Bon Jovi, U2, Led Zeppelin, Aerosmith 📻Baladas de rock dos anos 70s 80s, 90s;Music In Paradise;Eu, a Patroa e as Crianças | 2ª Temporada Completa (Dublado HD);VITOR KEVIN;Poesia Acústica #6 - Era Uma Vez - Mc Cabelinho, Orochi, Bob, Maquiny, Azzy, Filipe Ret, Dudu, Xamã;PineappleStormTV;Ibiza Summer Mix 2022 🍓 Best Of Tropical Deep House Music Chill Out Mix 2022 🍓 Chillout Lounge;Miracle Music;Henrique e Juliano Cd Completo 2022 - As Mais Tocadas do Henrique e Juliano 2022 -Top Sertanejo 2022;Mix Sertanejo;Música calmante para os nervos 🌿 música curativa para o coração e vasos sanguíneos, relaxamento;Love YourSelf;Os Tiktok mais HILÁRIOS e ENGRAÇADO do LKZINHU 😂 PARTE 2;TikTok Premium;Deliciosa comida tradicional do mercado - TOP 3 Frango, tteokbokki, hotteok / comida de rua coreana;찐푸드 JJin Food;;;;;;;;;;;;;;;;;
